{
  "format": "cuicui.gesture_score",
  "version": 1,
  "name": "gallery_defaults",
  "created_by": "WP-C4",
  "created_at": "2026-09-18T00:00:00Z",
  "settings": {
    "body.size": 1.0,
    "perf.breath": 0.7
  },
  "gestures": [
    {
      "t_s": 0.05,
      "duration_ms": 250.0,
      "type": "archetype:whistle",
      "anchor_hz": 2093.0,
      "params": {},
      "hints": {
        "oec_ratio": null,
        "gape": null,
        "second_voice_cents": null
      },
      "curves": {
        "samples": 64,
        "pitch_cents": [
          0.0,
          3.749055177626606,
          7.377173091458805,
          10.884353741496597,
          14.270597127739984,
          17.535903250188966,
          20.680272108843536,
          23.7037037037037,
          26.606198034769463,
          29.387755102040817,
          32.04837490551776,
          34.5880574452003,
          37.006802721088434,
          39.30461073318216,
          41.48148148148148,
          43.537414965986386,
          45.4724111866969,
          47.286470143613,
          48.97959183673469,
          50.55177626606198,
          52.00302343159486,
          53.33333333333334,
          54.5427059712774,
          55.63114134542706,
          56.598639455782305,
          57.44520030234316,
          58.1708238851096,
          58.77551020408163,
          59.25925925925926,
          59.62207105064248,
          59.86394557823129,
          59.98488284202569,
          59.9848828420257,
          59.863945578231295,
          59.62207105064248,
          59.25925925925926,
          58.775510204081634,
          58.1708238851096,
          57.44520030234316,
          56.59863945578231,
          55.63114134542707,
          54.5427059712774,
          53.33333333333334,
          52.00302343159486,
          50.551776266061985,
          48.9795918367347,
          47.28647014361301,
          45.472411186696895,
          43.53741496598639,
          41.481481481481474,
          39.304610733182166,
          37.006802721088434,
          34.588057445200306,
          32.04837490551776,
          29.387755102040824,
          26.606198034769463,
          23.703703703703713,
          20.680272108843536,
          17.535903250188973,
          14.270597127739984,
          10.88435374149661,
          7.377173091458805,
          3.749055177626619,
          0.0
        ],
        "amp_db": [
          -60.0,
          -56.346647201106855,
          -46.276387915972784,
          -32.24190280759273,
          -17.66138690608166,
          -6.0860247833123315,
          -0.33507521324614764,
          0.0,
          0.0,
          0.0,
          0.0,
          0.0,
          0.0,
          0.0,
          0.0,
          0.0,
          0.0,
          0.0,
          0.0,
          0.0,
          0.0,
          0.0,
          0.0,
          0.0,
          0.0,
          0.0,
          0.0,
          0.0,
          0.0,
          0.0,
          0.0,
          0.0,
          0.0,
          0.0,
          0.0,
          0.0,
          0.0,
          0.0,
          0.0,
          0.0,
          0.0,
          0.0,
          0.0,
          0.0,
          0.0,
          0.0,
          0.0,
          0.0,
          0.0,
          0.0,
          0.0,
          0.0,
          0.0,
          0.0,
          -0.3350752132461343,
          -3.4185146870959726,
          -9.41275086393797,
          -17.66138690608166,
          -27.261158668840515,
          -37.16084634009413,
          -46.276387915972755,
          -53.60958904982067,
          -58.35742999193173,
          -60.0
        ],
        "tone": [
          0.9,
          0.9,
          0.9,
          0.9,
          0.9,
          0.9,
          0.9,
          0.9,
          0.9,
          0.9,
          0.9,
          0.9,
          0.9,
          0.9,
          0.9,
          0.9,
          0.9,
          0.9,
          0.9,
          0.9,
          0.9,
          0.9,
          0.9,
          0.9,
          0.9,
          0.9,
          0.9,
          0.9,
          0.9,
          0.9,
          0.9,
          0.9,
          0.9,
          0.9,
          0.9,
          0.9,
          0.9,
          0.9,
          0.9,
          0.9,
          0.9,
          0.9,
          0.9,
          0.9,
          0.9,
          0.9,
          0.9,
          0.9,
          0.9,
          0.9,
          0.9,
          0.9,
          0.9,
          0.9,
          0.9,
          0.9,
          0.9,
          0.9,
          0.9,
          0.9,
          0.9,
          0.9,
          0.9,
          0.9
        ],
        "side": [
          -1.0,
          -1.0,
          -1.0,
          -1.0,
          -1.0,
          -1.0,
          -1.0,
          -1.0,
          -1.0,
          -1.0,
          -1.0,
          -1.0,
          -1.0,
          -1.0,
          -1.0,
          -1.0,
          -1.0,
          -1.0,
          -1.0,
          -1.0,
          -1.0,
          -1.0,
          -1.0,
          -1.0,
          -1.0,
          -1.0,
          -1.0,
          -1.0,
          -1.0,
          -1.0,
          -1.0,
          -1.0,
          -1.0,
          -1.0,
          -1.0,
          -1.0,
          -1.0,
          -1.0,
          -1.0,
          -1.0,
          -1.0,
          -1.0,
          -1.0,
          -1.0,
          -1.0,
          -1.0,
          -1.0,
          -1.0,
          -1.0,
          -1.0,
          -1.0,
          -1.0,
          -1.0,
          -1.0,
          -1.0,
          -1.0,
          -1.0,
          -1.0,
          -1.0,
          -1.0,
          -1.0,
          -1.0,
          -1.0,
          -1.0
        ]
      }
    },
    {
      "t_s": 0.38,
      "duration_ms": 120.0,
      "type": "archetype:upsweep",
      "anchor_hz": 2093.0,
      "params": {},
      "hints": {
        "oec_ratio": null,
        "gape": null,
        "second_voice_cents": null
      },
      "curves": {
        "samples": 64,
        "pitch_cents": [
          -900.0,
          -867.4756301058337,
          -835.9675627525507,
          -805.4440411111034,
          -775.8743006713169,
          -747.228538234486,
          -719.4778818748775,
          -692.5943618398535,
          -666.550882359293,
          -641.3211943358974,
          -616.87986888885,
          -593.202271724171,
          -570.2645383059313,
          -548.0435498033016,
          -526.5169097891944,
          -505.6629216670133,
          -485.46056680275814,
          -465.8894833404448,
          -446.9299456794896,
          -428.5628445933702,
          -410.76966796953025,
          -393.5324821511089,
          -376.8339138616958,
          -360.6571326948884,
          -344.98583415100757,
          -329.8042232038707,
          -315.0969983810609,
          -300.84933634164736,
          -287.04687693581025,
          -273.6757087313165,
          -260.7223549922536,
          -248.17376009589256,
          -236.01727637398884,
          -224.24065136525854,
          -212.83201546618204,
          -201.77986996768755,
          -191.07307546565738,
          -180.7008406335773,
          -170.65271134601016,
          -160.91856014193237,
          -151.48857601731677,
          -142.35325453666678,
          -133.50338825354342,
          -124.93005743042391,
          -116.62462104854093,
          -108.57870809864201,
          -100.7842091438894,
          -93.23326814639786,
          -85.91827454917201,
          -78.83185560546283,
          -71.96686894781145,
          -65.31639538929174,
          -58.87373194969495,
          -52.632385099628465,
          -46.586064215719084,
          -40.72867524032338,
          -35.05431453935729,
          -29.557262952050923,
          -24.231980026634915,
          -19.073098436145187,
          -14.075418568720066,
          -9.233903286936684,
          -4.543672850904779,
          -0.0
        ],
        "amp_db": [
          -60.0,
          -56.346647201106855,
          -46.276387915972784,
          -32.24190280759273,
          -17.66138690608166,
          -6.0860247833123315,
          -0.33507521324614764,
          0.0,
          0.0,
          0.0,
          0.0,
          0.0,
          0.0,
          0.0,
          0.0,
          0.0,
          0.0,
          0.0,
          0.0,
          0.0,
          0.0,
          0.0,
          0.0,
          0.0,
          0.0,
          0.0,
          0.0,
          0.0,
          0.0,
          0.0,
          0.0,
          0.0,
          0.0,
          0.0,
          0.0,
          0.0,
          0.0,
          0.0,
          0.0,
          0.0,
          0.0,
          0.0,
          0.0,
          0.0,
          0.0,
          0.0,
          0.0,
          0.0,
          0.0,
          0.0,
          0.0,
          0.0,
          0.0,
          0.0,
          -0.3350752132461343,
          -3.4185146870959726,
          -9.41275086393797,
          -17.66138690608166,
          -27.261158668840515,
          -37.16084634009413,
          -46.276387915972755,
          -53.60958904982067,
          -58.35742999193173,
          -60.0
        ],
        "tone": [
          0.8,
          0.8,
          0.8,
          0.8,
          0.8,
          0.8,
          0.8,
          0.8,
          0.8,
          0.8,
          0.8,
          0.8,
          0.8,
          0.8,
          0.8,
          0.8,
          0.8,
          0.8,
          0.8,
          0.8,
          0.8,
          0.8,
          0.8,
          0.8,
          0.8,
          0.8,
          0.8,
          0.8,
          0.8,
          0.8,
          0.8,
          0.8,
          0.8,
          0.8,
          0.8,
          0.8,
          0.8,
          0.8,
          0.8,
          0.8,
          0.8,
          0.8,
          0.8,
          0.8,
          0.8,
          0.8,
          0.8,
          0.8,
          0.8,
          0.8,
          0.8,
          0.8,
          0.8,
          0.8,
          0.8,
          0.8,